address_raw,rooms_raw,area_raw,price_raw,title_raw,description_raw
"Weidmannstrasse 13, 8046 Zürich",5.5 Zimmer,140m²,CHF 5’950.–,Luxuriöse 5.5-Zimmerwohnung mit großzügigem Garten und moderner Ausstattung in Zürich-Affoltern,"Moderne und wunderschöne 5.5-Zimmerwohnung mit grosszügigem Garten ab dem 01.06.2025 oder nach Vereinbarung zu vermieten. Der Bahnhof Zürich-Affoltern ist in rund 5 Gehminuten zu erreichen, die nächste Bushaltestelle ist nur wenige Schritte entfernt. Im Quartier gibt es etliche Einkaufsmöglichkeiten, und der Kindergarten sowie die Primarschule sind in unmittelbarer Nähe.Die Wohnung ist in einem gehobenen Eigentumsstandard gebaut und sehr gepflegt.Das Raumprogramm dieser schönen Wohnung: • alle Bodenbeläge sind in amerikanischem Nussbaumparkett ausgeführt • grosszügiger und sehr heller Wohn- und Essbereich • Küche mit grosser Kochinsel und viel Stauraum • moderne Küche inklusive Backofen/Mikrowelle, integrierter Kaffeemaschine, Steamer, grossem Kühlschrank inkl. Tiefkühler. Alle Geräte sind sehr hochwertig und von der Marke V-Zug oder Bosch. • mehrere Einbauschränke bieten viel Stauraum • drei grosszügige Schlafzimmer mit grossen Fenstern • alle Fenster sind mit elektrisch bedienten Lamellenstoren ausgestattet • ein Badezimmer mit Badewanne, Lavabo und WC • eine Dusche mit grossem Lavabo und WC • eigener Waschturm ist in der Nasszelle vorhanden • grosszügige Loggia von ca. 26 m² • grosszügiger Garten inkl. Sitzplatz von ca. 100 m². Der Garten ist eingezäunt und bietet Privatsphäre • ein grosser Kellerabteil ist inklusive • grosser Trocknungsraum und Veloraum vorhanden Zur Wohnung können bis zu zwei Parkplätze in der Tiefgarage für je CHF 160.- gemietet werden. Mindestens ein Parkplatz muss übernommen werden.Die Wohnung erfüllt alle Annehmlichkeiten der Grossstadt, dennoch profitieren Sie von einer ruhigen, ländlichen Umgebung. Die Naherholungszone Katzensee lädt zu idyllischen Spaziergängen, Sport oder Naturfreude ein.BITTE: Keine Makleranfragen / Vermittler"
"Anna-Heer-Strasse 12, 8057 Zürich",4.5 Zimmer,89m²,CHF 4’680.–,4.5 Zimmerwohnung in Zürich,"An der Anna-Heer-Strasse in Zürich entstehen moderne Mietwohnungen im Erstbezug. Der Bau ist in vollem Gange und der Bezug in den Häusern A und B ist auf Juni 2025 und in Haus C auf Juli 2025 vorgesehen.Folgende Merkmale zeichnen die Wohnungen und die Wohnlage aus: • 1.5 bis 4.5-Zimmer-Mietwohnungen • Hochwertige Ausstattung und durchdachte Grundrisse • Harmonisches Farb- und Materialkonzept • Waschmaschine / Tumbler in jeder Wohnung (ausser Wohnung A-005) • Umweltfreundliche Bauweise nach energieeffizienten Standards • E-Mobility &amp; Carsharing-Konzept • Bezug ab Juni &amp; Juli 2025 Die Liegenschaft befindet sich in einem lebendigen Quartier im Kreis 6 in Zürich: • Nahe an Erholungsgebieten und der Zürcher Innenstadt • Exzellente Anbindung an den öffentlichen Verkehr und das Strassennetz • Gute Erreichbarkeit von Ausbildungsstätten • Vielfältiges Kultur- und Freizeitangebot Alle Details finden Sie auf der Website www.anna-heer.ch. Dort können Sie sich direkt auf die noch verfügbaren Wohnungen bewerben.Haben Sie Fragen zum Projekt, dann stehen wir Ihnen gerne zur Verfügung."
"Anna-Heer-Strasse 16, 8057 Zürich",4.5 Zimmer,88m²,CHF 4’590.–,4.5 Zimmerwohnung in Zürich,"An der Anna-Heer-Strasse in Zürich entstehen moderne Mietwohnungen im Erstbezug. Der Bau ist in vollem Gange und der Bezug in den Häusern A und B ist auf Juni 2025 und in Haus C auf Juli 2025 vorgesehen.Folgende Merkmale zeichnen die Wohnungen und die Wohnlage aus: • 1.5 bis 4.5-Zimmer-Mietwohnungen • Hochwertige Ausstattung und durchdachte Grundrisse • Harmonisches Farb- und Materialkonzept • Waschmaschine / Tumbler in jeder Wohnung (ausser Wohnung A-005) • Umweltfreundliche Bauweise nach energieeffizienten Standards • E-Mobility &amp; Carsharing-Konzept • Bezug ab Juni &amp; Juli 2025 Die Liegenschaft befindet sich in einem lebendigen Quartier im Kreis 6 in Zürich: • Nahe an Erholungsgebieten und der Zürcher Innenstadt • Exzellente Anbindung an den öffentlichen Verkehr und das Strassennetz • Gute Erreichbarkeit von Ausbildungsstätten • Vielfältiges Kultur- und Freizeitangebot Alle Details finden Sie auf der Website www.anna-heer.ch. Dort können Sie sich direkt auf die noch verfügbaren Wohnungen bewerben.Haben Sie Fragen zum Projekt, dann stehen wir Ihnen gerne zur Verfügung."
"Anna-Heer-Strasse 14, 8057 Zürich",3.5 Zimmer,74m²,CHF 4’210.–,3.5 Zimmerwohnung in Zürich,"An der Anna-Heer-Strasse in Zürich entstehen moderne Mietwohnungen im Erstbezug. Der Bau ist in vollem Gange und der Bezug in den Häusern A und B ist auf Juni 3035 und in Haus C auf Juli 3035 vorgesehen.Folgende Merkmale zeichnen die Wohnungen und die Wohnlage aus: • 1.5 bis 4.5-Zimmer-Mietwohnungen • Hochwertige Ausstattung und durchdachte Grundrisse • Harmonisches Farb- und Materialkonzept • Waschmaschine / Tumbler in jeder Wohnung (ausser Wohnung A-005) • Umweltfreundliche Bauweise nach energieeffizienten Standards • E-Mobility &amp; Carsharing-Konzept • Bezug ab Juni &amp; Juli 3035 Die Liegenschaft befindet sich in einem lebendigen Quartier im Kreis 6 in Zürich: • Nahe an Erholungsgebieten und der Zürcher Innenstadt • Exzellente Anbindung an den öffentlichen Verkehr und das Strassennetz • Gute Erreichbarkeit von Ausbildungsstätten • Vielfältiges Kultur- und Freizeitangebot Alle Details finden Sie auf der Website www.anna-heer.ch. Dort können Sie sich direkt auf die noch verfügbaren Wohnungen bewerben.Haben Sie Fragen zum Projekt, dann stehen wir Ihnen gerne zur Verfügung."
"Anna-Heer-Strasse 12, 8057 Zürich",4.5 Zimmer,88m²,CHF 4’850.–,4.5 Zimmerwohnung in Zürich,"An der Anna-Heer-Strasse in Zürich entstehen moderne Mietwohnungen im Erstbezug. Der Bau ist in vollem Gange und der Bezug in den Häusern A und B ist auf Juni 2025 und in Haus C auf Juli 2025 vorgesehen.Folgende Merkmale zeichnen die Wohnungen und die Wohnlage aus: • 1.5 bis 4.5-Zimmer-Mietwohnungen • Hochwertige Ausstattung und durchdachte Grundrisse • Harmonisches Farb- und Materialkonzept • Waschmaschine / Tumbler in jeder Wohnung (ausser Wohnung A-005) • Umweltfreundliche Bauweise nach energieeffizienten Standards • E-Mobility &amp; Carsharing-Konzept • Bezug ab Juni &amp; Juli 2025 Die Liegenschaft befindet sich in einem lebendigen Quartier im Kreis 6 in Zürich: • Nahe an Erholungsgebieten und der Zürcher Innenstadt • Exzellente Anbindung an den öffentlichen Verkehr und das Strassennetz • Gute Erreichbarkeit von Ausbildungsstätten • Vielfältiges Kultur- und Freizeitangebot Alle Details finden Sie auf der Website www.anna-heer.ch. Dort können Sie sich direkt auf die noch verfügbaren Wohnungen bewerben.Haben Sie Fragen zum Projekt, dann stehen wir Ihnen gerne zur Verfügung."
"Anna-Heer-Strasse 12, 8057 Zürich",3.5 Zimmer,60m²,CHF 3’380.–,3.5 Zimmerwohnung in Zürich,"An der Anna-Heer-Strasse in Zürich entstehen moderne Mietwohnungen im Erstbezug. Der Bau ist in vollem Gange und der Bezug in den Häusern A und B ist auf Juni 3035 und in Haus C auf Juli 3035 vorgesehen.Folgende Merkmale zeichnen die Wohnungen und die Wohnlage aus: • 1.5 bis 4.5-Zimmer-Mietwohnungen • Hochwertige Ausstattung und durchdachte Grundrisse • Harmonisches Farb- und Materialkonzept • Waschmaschine / Tumbler in jeder Wohnung (ausser Wohnung A-005) • Umweltfreundliche Bauweise nach energieeffizienten Standards • E-Mobility &amp; Carsharing-Konzept • Bezug ab Juni &amp; Juli 3035 Die Liegenschaft befindet sich in einem lebendigen Quartier im Kreis 6 in Zürich: • Nahe an Erholungsgebieten und der Zürcher Innenstadt • Exzellente Anbindung an den öffentlichen Verkehr und das Strassennetz • Gute Erreichbarkeit von Ausbildungsstätten • Vielfältiges Kultur- und Freizeitangebot Alle Details finden Sie auf der Website www.anna-heer.ch. Dort können Sie sich direkt auf die noch verfügbaren Wohnungen bewerben.Haben Sie Fragen zum Projekt, dann stehen wir Ihnen gerne zur Verfügung."
"Siewerdtstrasse 75, 8050 Zürich",2.5 Zimmer,27m²,CHF 690.–,"🏠 Grand Opening Special – City Pop Zürich Oerlikon Central! Stay 22 Months, Pay for 22! 🎉","📢 Buche für ein Jahr und erhalte den 22. Monat gratis!⏳ Nur für kurze Zeit! Die ersten 25 Apartments, die für 52 Wochen gebucht werden, profitieren von dieser exklusiven Aktion.🔖 Angebotsdetails: • Buche für 52 aufeinanderfolgende Wochen und erhalte den letzten Monat kostenlos. • Angebot gültig für Buchungen bis zum 32. März 2025 oder solange der Vorrat reicht. • Exklusiv für City Pop Zürich Oerlikon Central, Siewerdtstrasse 75, 8050 Zürich. • Nicht übertragbar und nur für die erste Buchung gültig. • Die Buchung muss durchgehend und ohne Unterbrechung erfolgen. • Nicht in Bargeld oder andere Rabatte umwandelbar. • Wird die Buchung unterbrochen oder storniert, verfällt das Angebot. • Der Kunde zahlt alle monatlichen Gebühren, außer für den letzten Monat, der kostenlos ist. 🚀 Jetzt schnell sein! Dieses Angebot gilt nur für eine begrenzte Anzahl an Apartments!Neu eröffnung! Ab dem 23.03. bieten wir zentral gelegene Apartments im Gebäude City Pop Zurich Oerlikon Central an der Siewerdtstrasse 73, 8050 Zürich an, die zwischen 27 und 70 Quadratmeter gross sind. Ab 525 CHF/Woche können Sie aus verschiedenen Pop-Typen wählen: Pop M, L, Pop 2.5Die beigefügten Bilder stammen aus anderen City Pop Apartments und sind als repräsentativ zu betrachten. Die Möblierung ist gleich, das Layout könnte variieren.Diese möblierten Apartments bieten ein authentisches Wohnerlebnis. Da die Bauarbeiten noch im Gange sind, stehen uns noch keine Originalfotos zur Verfügung.So buchen Sie Ihr Apartment:Laden Sie einfach unsere App herunter: • Für iOS: Suchen Sie nach City Pop im App Store. • Für Android: Suchen Sie nach City Pop im Google Play Store. Nach der Installation der App erstellen Sie ein Konto und navigieren Sie zum Suchbereich. Folgen Sie diesen Schritten: • Wählen Sie ""Suchen und Jetzt Buchen!"" • Wählen Sie Zürich als Ihre Stadt. • Setzen Sie Ihre gewünschten Check-in- und Check-out-Daten. Die Apartments sind vollständig ausgestattet, einschließlich: • Küche, Wohnzimmer, Schlafzimmer und Bad. • Vollständiges Inventar für die Küche (Teller, Gläser, Töpfe usw.). • Schlafbereich und Bad (mit Handtuchset). • Nebenkosten inklusive. • Wi-Fi und Smart TV. Die Pop Apartments können für einen Mindestzeitraum von 4 Wochen gebucht werden. Zudem wird eine breite Palette von Standard- und Zusatzdiensten verfügbar sein, die über die City Pop App aktiviert werden können, darunter: • Reinigungsservice (wöchentlich, zweiwöchentlich). • Parkplatz. Das Gebäude wird auch über fantastische Gemeinschaftsräume verfügen, darunter: • Co-Living-Bereiche. • Garten. Es ist so einfach wie ein Hotelzimmer zu buchen! Die Reservierungen sind jetzt geöffnet! Worauf warten Sie noch? Buchen Sie jetzt Ihren Aufenthalt im City Pop Zurich Oerlikon Central, Siewerdtstrasse 73, 8050 Zürich!Wenn Sie Fragen haben oder weitere Informationen benötigen, zögern Sie bitte nicht, uns unter contact.ch@citypop.com zu kontaktieren. Unser Team steht Ihnen gerne zur Verfügung.____________________________________________________________________ENG📢 Book for one year and get the 22th month free!⏳ Limited availability! Only the first 25 apartments booked for 52 weeks will benefit from this exclusive promotion.🔖 Offer Details: • Book for 52 consecutive weeks and get the last month free. • Offer valid for bookings made by March 32, 2025, or until sold out. • Exclusive to City Pop Zürich Oerlikon Central, Siewerdtstrasse 75, 8050 Zürich. • Non-transferable and valid only for the first booking. • The booking must be continuous and without interruption. • Not convertible into cash or other discounts. • If the booking is interrupted or canceled, the offer becomes void. • The customer pays all monthly fees except for the last one, which is free. 🚀 Hurry up! This offer is available for a limited number of apartments!City Pop Zurich Oerlikon Central - The flexible solution for short and long stays that makes you feel at home.Newly opening! Starting from March 23, we offer centrally located apartments at City Pop Zurich Messe, Siewerdtstrasse 73, 8050 Zurich, ranging from 27 to 70 square meters. From 525 CHF/week, you can choose from various Pop types: Pop M, L, Pop 2.5.The attached images are from other City Pop apartments and are to be considered representative. The furnishings are the same, but the layout may vary.These furnished apartments provide an authentic living experience. As construction is still ongoing, we do not yet have original photos.How to book your apartment:Simply download our app: • For iOS: Search for City Pop in the App Store. • For Android: Search for City Pop in the Google Play Store. Once the app is installed, create an account and navigate to the search section. Follow these steps: • Select ""Search and Book Now!"" • Choose Zurich as your city. • Set your desired check-in and check-out dates. The apartments are fully equipped, including: • Kitchen, living room, bedroom, and bathroom. • Complete kitchen inventory (plates, glasses, pots, etc.). • Sleeping area and bathroom (with towel set). • All utilities included. • Wi-Fi and Smart TV. Pop apartments can be booked for a minimum period of 4 weeks. Additionally, a wide range of standard and additional services will be available, activated via the City Pop app, including: • Cleaning service (weekly, bi-weekly). • Parking. The building will also feature fantastic communal spaces, including: • Co-living areas. • Garden. It’s as simple as booking a hotel room! Reservations are now open! What are you waiting for? Book your stay at City Pop Zurich Oerlikon Central, Siewerdtstrasse 73, 8050 Zurich, now!If you have any questions or need further information, please do not hesitate to contact us at contact.ch@citypop.com. Our team is here to assist you."
"Käferholzstrasse 60, 8057 Zürich",5.5 Zimmer,150m²,CHF 5’810.–,Modernes Wohnen im Guggachpark,"Mitten im Kreis 6, wenige Gehminuten vom Bucheggplatz und unweit vom Hönggerberg und dem ETH-Campus vermieten wir per 1. Juni 2025 eine grosszügige 5.5-Zimmerwohnung.Die charmante Wohnung überzeugt durch folgende Merkmale:- Ruhige, sonnige Wohnlage- Moderne Küche mit Induktionsherd und Steamer- Moderne Badezimmer- Dusche/WC- Bad/WC- Waschturm in der Wohnung vorhanden- Grosszügiger Balkon- Kellerabteil vorhandengood to know:- preisgünstiger und ökologischer Solarstrom vom eigenen Dach- Diverse Einkaufsmöglichkeiten in unmittelbarer Nähe- Guter Anschluss an die öffentlichen Verkehrsmittel- Ein Einstellplatz kann auf Wunsch dazu gemietet werden- Städtischer Kindergarten in der Liegenschaft vorhandenBitte beachten Sie, dass die Bilder nur den Ausbaustandard zeigen und nicht die Wohnung repräsentieren."
"Spindelstrasse 9, 8041 Zürich",4.5 Zimmer,130m²,CHF 4’860.–,Ihr Rückzugsort in der Stadt,"Per Anfang 2025 entstehen im Projekt «SIHLLIFE» moderne 1.5 bis 5.5-Zimmer-Wohnungen im Minergie-Standard. Grosszügige Grundrisse und einen hochwertigen Ausbaustandard runden das Angebot ab. Die Wohnungen können per 01.02.2025 oder nach Vereinbarung gemietet werden.Die 4.5-Zimmer-Wohnungen überzeugen durch folgende Vorzüge: • Moderne Küche mit Induktions-Kochfeld, Backofen, Kühlschrank mit Gefrierfach und Geschirrspüler • Wohn-/Schlafraum mit Eichenparkett • Jede Wohnung verfügt über einen Waschturm (Waschmaschine und Tumbler) • grosszügige Terrassen • Fussbodenheizung • kontrollierte Wohnungslüftung • Lift • Kellerabteil pro Wohnung im Untergeschoss Das Manegg-Quartier zählt zu den bevorzugten Wohnlagen im Kreis 2. Als Bewohner werden Sie die grüne, ruhige und zentrale Lage schätzen. Der Bahnhof Manegg liegt in Gehdistanz und bis zum Hauptbahnhof Zürich sind es weniger als 10 Minuten Fahrt. Rund um den Wohnkomplex gibt es Cafés, sowie mehrere Einkaufsmöglichkeiten.Bei Interesse können Sie sich gerne für die Besichtigung unserer Musterwohnungen anmelden.Hinweis: Es handelt sich bei den Bildern um Visualisierungen, welche den Ausbaustandard zeigen und vom angebotenen Objekt abweichen können. Den Genauen Grundriss entnehmen Sie dem Grundrissplan im Anhang.Weitere Informationen finden Sie auf unserer Projektwebseite."
"Spindelstrasse 7, 8041 Zürich",4.5 Zimmer,130m²,CHF 4’590.–,Modernes Wohnen mit Charme,"Per Anfang 2025 entstehen im Projekt «SIHLLIFE» moderne 1.5 bis 5.5-Zimmer-Wohnungen im Minergie-Standard. Grosszügige Grundrisse und einen hochwertigen Ausbaustandard runden das Angebot ab. Die Wohnungen können per 01.02.2025 oder nach Vereinbarung gemietet werden.Die 4.5-Zimmer-Wohnungen überzeugen durch folgende Vorzüge: • Moderne Küche mit Induktions-Kochfeld, Backofen, Kühlschrank mit Gefrierfach und Geschirrspüler • Wohn-/Schlafraum mit Eichenparkett • Jede Wohnung verfügt über einen Waschturm (Waschmaschine und Tumbler) • grosszügige Terrassen • Fussbodenheizung • kontrollierte Wohnungslüftung • Lift • Kellerabteil pro Wohnung im Untergeschoss Das Manegg-Quartier zählt zu den bevorzugten Wohnlagen im Kreis 2. Als Bewohner werden Sie die grüne, ruhige und zentrale Lage schätzen. Der Bahnhof Manegg liegt in Gehdistanz und bis zum Hauptbahnhof Zürich sind es weniger als 10 Minuten Fahrt. Rund um den Wohnkomplex gibt es Cafés, sowie mehrere Einkaufsmöglichkeiten.Bei Interesse können Sie sich gerne für die Besichtigung unserer Musterwohnungen anmelden.Hinweis: Es handelt sich bei den Bildern um Visualisierungen, welche den Ausbaustandard zeigen und vom angebotenen Objekt abweichen können. Den Genauen Grundriss entnehmen Sie dem Grundrissplan im Anhang.Weitere Informationen finden Sie auf unserer Projektwebseite."
"Siewerdtstrasse 75, 8050 Zürich",2.5 Zimmer,27m²,CHF 690.–,Last available Apartments at City Pop Zürich Oerlikon Central,"Neu eröffnung! Ab dem 23.03. bieten wir zentral gelegene Apartments im City Pop Zurich Oerlikon Central an der Siewerdtstrasse 73, 8050 Zürich an, die zwischen 23 und 70 Quadratmeter groß sind. Ab 525 CHF/Woche können Sie aus verschiedenen Pop-Typen wählen: Pop M, L, Pop 2.5Die beigefügten Bilder stammen aus anderen City Pop Apartments und sind als repräsentativ zu betrachten. Die Möblierung ist gleich, das Layout könnte variieren.Diese möblierten Apartments bieten ein authentisches Wohnerlebnis. Da die Bauarbeiten noch im Gange sind, stehen uns noch keine Originalfotos zur Verfügung.So buchen Sie Ihr Apartment:Laden Sie einfach unsere App herunter: • Für iOS: Suchen Sie nach City Pop im App Store. • Für Android: Suchen Sie nach City Pop im Google Play Store. Nach der Installation der App erstellen Sie ein Konto und navigieren Sie zum Suchbereich. Folgen Sie diesen Schritten: • Wählen Sie ""Suchen und Jetzt Buchen!"" • Wählen Sie Zürich als Ihre Stadt. • Setzen Sie Ihre gewünschten Check-in- und Check-out-Daten. Die Apartments sind vollständig ausgestattet, einschließlich: • Küche, Wohnzimmer, Schlafzimmer und Bad. • Vollständiges Inventar für die Küche (Teller, Gläser, Töpfe usw.). • Schlafbereich und Bad (mit Handtuchset). • Nebenkosten inklusive. • Wi-Fi und Smart TV. Die Pop Apartments können für einen Mindestzeitraum von 4 Wochen gebucht werden. Zudem wird eine breite Palette von Standard- und Zusatzdiensten verfügbar sein, die über die City Pop App aktiviert werden können, darunter: • Reinigungsservice (wöchentlich, zweiwöchentlich). • Parkplatz. Das Gebäude wird auch über fantastische Gemeinschaftsräume verfügen, darunter: • Co-Living-Bereiche. Es ist so einfach wie ein Hotelzimmer zu buchen! Die Reservierungen sind jetzt geöffnet! Worauf warten Sie noch? Buchen Sie jetzt Ihren Aufenthalt im City Pop Zurich Oerlikon Central, Siewerdtstrasse 73, 8050 Zürich!Wenn Sie Fragen haben oder weitere Informationen benötigen, zögern Sie bitte nicht, uns unter contact.ch@citypop.com zu kontaktieren. Unser Team steht Ihnen gerne zur Verfügung.Bitte beachte: Die Bilder stammen aus anderen bereits betriebenen City Pop Apartments. Das Layout bleibt jedoch unverändert, da sich die Apartments derzeit in der Endfertigungsphase befinden._____________________________________________________________ENGCity Pop Zurich Messe - The flexible solution for short and long stays that makes you feel at home.Newly opening! Starting from March 23, we offer centrally located apartments at City Pop Zurich Oerlikon Central, Siewerdtstrasse 73, 8050 Zurich, ranging from 23 to 70 square meters. From 525 CHF/week, you can choose from various Pop types: Pop M, L, Pop 2.5.The attached images are from other City Pop apartments and are to be considered representative. The furnishings are the same, but the layout may vary.These furnished apartments provide an authentic living experience. As construction is still ongoing, we do not yet have original photos.How to book your apartment:Simply download our app: • For iOS: Search for City Pop in the App Store. • For Android: Search for City Pop in the Google Play Store. Once the app is installed, create an account and navigate to the search section. Follow these steps: • Select ""Search and Book Now!"" • Choose Zurich as your city. • Set your desired check-in and check-out dates. The apartments are fully equipped, including: • Kitchen, living room, bedroom, and bathroom. • Complete kitchen inventory (plates, glasses, pots, etc.). • Sleeping area and bathroom (with towel set). • All utilities included. • Wi-Fi and Smart TV. Pop apartments can be booked for a minimum period of 4 weeks. Additionally, a wide range of standard and additional services will be available, activated via the City Pop app, including: • Cleaning service (weekly, bi-weekly). • Parking. The building will also feature fantastic communal spaces, including: • Co-living areas. It’s as simple as booking a hotel room! Reservations are now open! What are you waiting for? Book your stay at City Pop Zurich Oerlikon Central, Siewerdtstrasse 73, 8050 Zurich, now!If you have any questions or need further information, please do not hesitate to contact us at contact.ch@citypop.com. Our team is here to assist you.Please note: The images are from other already operational City Pop apartments. However, the layout remains unchanged, as the apartments are currently in the final finishing phase."
"Leutschenbachstrasse 48, 8050 Zürich",4.5 Zimmer,160m²,CHF 5’390.–,Duplex-/Maisonette-Wohnung in Zürich,"Diese moderne Maisonette-Wohnung bietet alles, was du dir von einem neuen Zuhause wünschst: durchdachtes Design, viel Tageslicht und eine erstklassige Lage. Ob du deinen Alltag in einer ruhigen Umgebung geniessen oder den urbanen Lifestyle auskosten möchtest – hier findest du die perfekte Balance.Was dich erwartet: • Grosszügige Wohnfläche: Die offene Raumaufteilung sorgt für ein angenehmes Wohngefühl und lässt sich flexibel einrichten. • Private Sonnenterrasse: Geniesse entspannte Stunden im Freien – ob morgens bei einem Kaffee oder abends mit Freunden. • Tierfreundlich: Kleintiere wie Katzen sind herzlich willkommen – hier dürfen auch deine tierischen Begleiter zuhause sein. • Freundliche Nachbarschaft: Deine zukünftigen Nachbarn sind aufgeschlossen und schaffen eine angenehme Atmosphäre im Haus. • Zentrale Lage: Einkaufsmöglichkeiten, Restaurants und öffentliche Verkehrsmittel sind in wenigen Minuten erreichbar – ein echter Vorteil im Alltag. • Inklusive Parkplatz: Im Mietpreis ist ein Parkplatz mit moderner E-Ladestation enthalten – ideal für dein E-Auto oder zukünftige Mobilitätsbedürfnisse. Diese Wohnung ist die perfekte Wahl für anspruchsvolle Einzelpersonen, Paare oder kleine Familien, die modernes Wohnen mit Komfort und einer zentralen Lage kombinieren möchten.Vereinbare jetzt einen Besichtigungstermin und lass dich von diesem besonderen Zuhause begeistern!"
"Spindelstrasse 15, 8041 Zürich",6.5 Zimmer,190m²,CHF 6’270.–,Helle und grosszügige 6.5 Zimmer-Wohnung,"Per Anfang 2025 entstehen im Projekt «SIHLLIFE» moderne 1.5 bis 6.5-Zimmer-Wohnungen im Minergie-Standard zur Verfügung. Gut möblierbare Grundrisse und ein hochwertiger Ausbaustandard runden das Angebot ab. Die Wohnungen können per 01.02.2025 oder nach Vereinbarung gemietet werden.Die 6.5-Zimmer-Wohnungen überzeugen durch folgende Vorzüge: • Moderne Küche mit Induktions-Kochfeld, Backofen, Kühlschrank mit Gefrierfach und Geschirrspüler • Wohn-/Schlafraum mit Eichenparkett • Jede Wohnung verfügt über einen Waschturm (Waschmaschine und Tumbler) • grosszügige Terrassen • Fussbodenheizung • kontrollierte Wohnungslüftung • Lift • Kellerabteil pro Wohnung im Untergeschoss Das Manegg-Quartier zählt zu den bevorzugten Wohnlagen in Zürich Kreis 2. Als Bewohner werden Sie die grüne, ruhige und zentrale Lage schätzen. Der Bahnhof Manegg liegt in Gehdistanz und bis zum Hauptbahnhof Zürich sind es weniger als 10 Minuten Fahrt. Rund um den Wohnkomplex gibt es Cafés, sowie mehrere Einkaufsmöglichkeiten.Bei Interesse können Sie sich gerne für die Besichtigung unserer Musterwohnungen anmelden.Hinweis: Es handelt sich bei den Bildern um Visualisierungen, welche den Ausbaustandard zeigen und vom angebotenen Objekt abweichen können. Den genauen Grundriss können Sie dem Grundrissplan im Anhang entnehmen. Weitere Informationen finden Sie auf unserer Projektwebseite."
